{
  "subject_type": "email",
  "subject_value": "alice@example.com",
  "exposed": true,
  "exposure_count": 7,
  "first_seen": "2013-12-04T00:00:00Z",
  "last_seen": "2025-11-12T08:14:00Z",
  "breach_sources": [
    {
      "breach_name": "Adobe",
      "breach_date": "2013-10-04",
      "data_classes": ["Email addresses", "Password hints", "Passwords"]
    },
    {
      "breach_name": "LinkedIn",
      "breach_date": "2012-05-05",
      "data_classes": ["Email addresses", "Passwords"]
    },
    {
      "breach_name": "RedLine Stealer Logs Q3 2025",
      "breach_date": "2025-08-21",
      "data_classes": ["Email addresses", "Passwords", "Session tokens", "Browser user agents"]
    }
  ],
  "stealer_log_hits": 2,
  "password_strength": "weak",
  "risk_level": "high",
  "recommended_action": "force-password-reset"
}
